{"content_digest":"0816eb49fea0f398c2beded910f5d6cbde806c92eafc6cab6681744901c287db","created_on":"2026-09-06T10:23:00Z","endpoint":{"base_url":"https://ollama.com","kind":"ollama-chat","options":{"seed":7,"temperature":0},"think":false,"timeout_seconds":300},"epistemic_limit":"Survival of criticism leaves a claim unrefuted; pass counts, consensus, and confidence do not justify it.","executor_kind":"ollama-chat","family_counts":[{"count":16,"family":"BASELINE"},{"count":14,"family":"RIVAL_SUBSTITUTION"},{"count":16,"family":"SEMANTIC_ROLE_TWIN"},{"count":16,"family":"SUBSTRATE_SWAP"},{"count":2,"family":"BOUNDARY_SHIFT"},{"count":32,"family":"IMPORT_DEPENDENCY"},{"count":12,"family":"NON_VACUITY"},{"count":16,"family":"ROUND_TRIP"},{"count":32,"family":"REPEAT"}],"field_verdict_counts":[{"count":928,"verdict":"MATCH"},{"count":185,"verdict":"MISMATCH"},{"count":3,"verdict":"MISSING_REQUIRED"},{"count":3,"verdict":"EXTRA_FIELD"},{"count":288,"verdict":"NOT_SCORED"}],"format_enforced_by_server":null,"grounding_verdict_counts":[],"live_locus_counts":[{"count":64,"locus":"CANDIDATE"},{"count":46,"locus":"AUXILIARY"},{"count":86,"locus":"TEST"},{"count":42,"locus":"SCOPE"}],"model":"gemma4:31b","model_call_count":144,"observation_ids":["1f9ec8c756b2210477474b1d629b52ab1ef67ad46b2d629da5b4f0b98bd6cffb","f9d2b81c191a16440e4b4fe012160c4b4620c943adca5957368366fb791c29cd","a66e00d2f21a126d6103967ab91e4c34c26d5c18a9e0d668782674447430f8d2","b5b4cdfd64641cff3045a26b9a61b22f4d6606e0e630a0112caf95e18251dfc9","ce78624cc9d770249c9a804d8d307b32eedff89648cc5187d3d7fb3d6c456ebe","476c2b3e6f85597d9cbf88d33f18aeb64fd5f20bdc7dbd52ec0472f3f43ed6f8","e901850a9d013a3be81c73ddbeca257f6cfa7a7db272a9c51fa2b0977bd0f645","3a43b80cfd6eec6a173ccec24a83c30d5d78fc9530af2fab52064ab78cdb1437","6ca97e57b25d447e652d5077cc674b22a7a5587de8628af3ab6837eb68aee5fd","fbd23233e71d77f70aa482a5172ca8081e955df51c6b1505a06cb9380125e705","a231bd932c3caab28b8bd584b4651b5a73a56f60c459e464cce1c926a08b2827","21cf9c4cf062931a9646379ef7548f28195cc684fb24b142402a2b67987b721b","360c45d0390ccfa0d540737ff39e3cf13083209bbacb5992d07a88f56bc11e52","5eb37e1e3180f87168af9450aa9463a8d56b55f5c90bf6fd9660f64e2dca6e05","c727bd87bdfa23413f28eaff5a76546d01e5f712bc10b63227294d1531f83d27","eecf6c3b135439a7f2f6b2a59d299a6e843ad3638b8e3dedcc1b6d2a6fbd865e","f8a2465595921707ac704cdd89eebc46da548d108d4bd550cf30ea2a1562224c","85b00d8590b22b3529efe87936bc939c4194bd06f5bc8b2cfa3839014606022b","c5dcad9859d79ab724a36028402c93798c1f26137a19de8bb49ce34d0f6f4a33","f0449264ba840da9b343eb79d4d96971edf1f4916d90b20fff98d77b0d6cbaaf","81a19e68d7dfa68f9fa95d8237e41668b599367b9ff8974e06eec7ff806aa7c0","9dd7fb301ec0cd76a7e76d3155da6029da8346e0300902a75a03970ae0aedec3","13e77fe935c642dbdd3bc288684ad5a635dfc6687f7ea43be04c2ef9a5d580bc","bf4eda9da4de5a9c9b8f63b042e9d0a0e68c99fe3b18cf973aa8ce86afdc426b","99d119802466c4a7e7a629b33209e353d0f12a3ace56eadf28026c7ac8602f56","ee2dca3a6b7f77cc1c77fd2f83a6e6f0f1e9a385b4c2d96149313cfcf526106d","be1bcc6043f93450eb4e646f8a55e09c5192760fe715f7949b46ddae88ee72cf","81192f4282dcf08633e85853f8948a5230eca6d65ec0e3516269eb701013e359","94eec5b4f502acf7dc0b2ac9265a29ccecc12893d7b8a4de1eb250bce0d7efc7","5f908bfac2081218a129302f8a7feed916fe5af677b4263a761c62e323462c3e","32f3de71a519b697a01f7516bfa5954937056984f7e793b2a3ddbef526600298","cb00fd3ee6c7f7ea5d8590759aed97e2a0882ad72274471fe079ff57d164d652","0a79814a4ff29a8b4e0d2dba57937c0ad6d88471579f79462c6d245d6a193079","8ed139e795d318e67a693e90f45729f89a57eedca267e8ba7ca20adb811d113e","3ab1ee674cc7fbca79326ee4ba4e985bc4b1d493a84e7a87562915e441d3cabb","d82ca8529b423786a0bed7c0f2ae75271d6c4963b4da6acdb07228ee36d626c1","0fb65a4960a0b6ac391fe60517d55c4f38836a65d1e6ff608d6b0d9a04120a1f","d07c9043853187dff5b9145c7fd44426305cada43517f5d94a2c169254e9c3a9","9520981f7c306d8359ec8f621098a9c860d5becd0f63026e3368c131f85aa37f","98793e0e7e903181d889bd56875f22143dbb31a909184e0411a2442e9b44e12c","46ad2cd6ba7537bd5c4bd1571c6a79dd63ac547ee03a871a08d0b6dc3dd02022","68af44f091557e884864c1067c1d56e5f827a6679c474d386c02924de9cf62ff","b742d19e0681f449b43e82f48b8c04e0ddc4ba7c2852f930a36d1de1ae1521f8","bd1227d316850c5dd71386eaec43f4db5d5a23281659defbaac09a0957d7d919","336086afed2779434a0955cd5f27aa5f403a0d37b7a599402d4b7a39c0afc7d4","018e937dc355b623d0b2e3067c9451cb575c4780cc4db5f1110e4b5668dba868","868f0f36d4de37ee5f044b66bc8c5eda868d346adab4e6df52c605e8c5a2f414","fc5679378f77147f90d329130427263417d07ca2824165af22fac1a4a176b504","d4930948be969a73000bb4d6913d1e9c875ff57b8b15dfa68c7f8ee9fd585ecf","b9433c3a5bd6d138f2eb39e0b3a8d45fd2f25c2d9c1103e4c07779f6e0ab849b","e2fa7ee1f58f4d4988b22c8f03adbf5ffeebd1888033fd7e740bb6eb9682ace9","0a3f6ff0f91db414083a7b8fba0dfbfb32c020211316d44e7e5a9ab9b480d476","96227b06e301fd4f2c2491d0a64dc2cab096262e5a5401f160d212ab56e857db","aac14a65082576f4a00c3b8acc1e64ef0acd442caa798ac6c2e9d65821f33d3d","69363cbf519bbff8bf13df1ea9523e29a4284c539a8713ecd10a432b4aac85dc","bce76aef900323b05c080f09b49126ac838623e29267cad7a470a737160d82e1","8996f1fb5cef3938504a372ad26e67a716aa80de6b62e189d21940b298c573e2","514187416944a92ded73d46f9cda8c67d8178c22e16fe1638edf8c4db0be3d37","549124ebee32d1c084c2732d79eb65e4e60d8c4b3b9287c05f14636af696711a","c84394d949fcbdbad8e78f5f9743dcdf6eff330c71df340f4c94b5d5ec4f4bff","602728f57d5374774860dba4f12e00f2718669bababd4de2c93efd6c67da5a2a","f3d233a5e8b9bb3b01b5cd7ce8a6a5d1a9b01888ddffcd6ae2b958904caaa917","4d6c8d894f267633e73d242464ae3e525c4acae32104bb017be367e7c2360449","1b493e0aed7040188f6461e3ce5a99bb9385cb12957bd733adb55e0de2f1e16d","a47dda97541bb1f0514b291c7abc01f06ff7de00cf915a072f462b0ce3d8ea5f","080613fc480843829972fc2355e3ae67a452f3aa1a74fdf0dde98557942e5ed1","ad7d27d951e00e627a1e8964002e9ea77136bb0fe9ef63163b2e6b4b68dd7b47","e84f1f0d29ea4e672b3a41de8b8e3931b9b6897c0ff87498e65f6093714ba258","68a6549189acdcb1c9762e5bf72b8d0102f0998dc095119766575a95967ac6d5","7230e182ef0f74be5d8e6f1086ed9eb7182ef8ec81ddb2cadab52b9abe12ee95","d10dc44de4a295e8bee1b5cdb8cfbb92aa43c49d36fa16cb9a980266b9345256","1e98cdf1be124bed767cec15e60a0cb627db2690fbf853cb3d01f450b01dbe17","a85d58218df29d9b4e0ccc990083a337fa02b2e3c44b9d2ef0679656c3d11654","6b2aa6c3bb717d4e951439c3edd16d3a1db5ca8e38022141464410388b68518c","cb1d3dfaf042a85edf89cb7391c585f0e2e17b0a4664eb39bdf706f0c71bc052","c60994f52e3ae188a02b786210c98eed46b951647ba6b09799b968e4db46dc4c","7d86f21685c46c543148248550b54a2fa8a8ed1ff610c4bcc772e053132a06c8","bb54f3d5d97bf42e39a78ea28798bccecfa8887d07740d86daa4ac1a54853621","ba76c413e37bbdfe6317e921dd2794fc579c0735d560c4bc632f461a10d01308","49ac42bda6f3215b57972526a63744181307ce3bf9d2ff96585f7f9b024dea8e","c7cccc464f523f307aba3bbf9ff01fc22f897d3fc1ae248ea4a2910a0df700c4","1be46db731614adfa7e6cf9376f9f6262331e99fe6110c15e59ec58a41f590a9","80cadcdb41f295adca24707eb9dea944e9314cc0d6ad27c602f7be4bf231a8f6","7adaa8c549556b4612a3ef199922262bc8d56aec923e1f7d8e30d047a8cbc6e5","d219e88e43f2662834bf29be564b215c066cbd49cb45fc00d2935b9aa424c8c9","8265ee4f51e65465d99222a402b0330191605538dee5c6d95f9c5ea57619b006","268b7cadd2d9f2c80bbe2bf444329eb4e39f5de0b1aba3d902e06dd93e274fd7","4d9c51bb2a579332617c36ef5a47a31f48c2aa24f373d3d92d2db927db43cb33","85b67c7c15c94dcb4332feb93102592c7e706050397000801f21cabbb5b3bb60","fed4e186a3126281c5fc71fbd85358019edc0575fd6ff816663691706bc888e7","34fc674fec03a6ab53f98cd701621b2d339b645c18cb5793be449fc0caa6ba62","be6374caef6f6c7580a0347b0645a48b5a77c3985546cf8258efb3b219c7d0d2","0623671f89d34ebc829cc91ffa0f24d5185e59248849f4d18593c756f474d973","f429a65ec4fb3eb29fe52d7724b4d8d67d0a5e8d8674a8667c78685956f55075","8fc652ebe4fa8338f2c2ddbf3b10f70f5b846b9c7294e9f09369a2bfa3c55bff","89b8a7f1f9f817ab1fb0a88be6140ba7dd85728ca1b3d951500e2dba4711d3a9","78ac66f19c3e63f28ab08997b962f854b805ef20ba695e1878793b601f00bbf5","25cd3899df44bd2e936f84a83a344ad17cf27f7a1885fbf9bbef79599104dc86","d493fb1a23a701208793e41fba03b13086f5c56750e4e4dee2c37cbe36fb7973","3be77dad32fcbf03671352c1481f35b979dc6617ec3b59a405ec106b10dde92b","9052bcc1cd5a734ea87a15d58a1c50f6364c34d64195fee0d91255e26d121dde","ce1d3854c7285585faf94d553d9acdea3660db4f1c0a6950ef31cf53aeadc770","4920416cd45e4ed3c83cec9dbb7512b2e05d837b887b8c75663f7f2e60545d70","7d3ee512172b3384854f78cf6865429ef944f8cd6b934ec688a843bf894e2c43","659c3d3d3dac28c0727ef478060affc895515328888374ffcf2501cb403b5009","3b3f326df5d7d2ebff6e9a5416958bae919cef3cd35cf8548d37ae8e8ead5e28","848e8d3c7e379bede0892ed6b96f65b257a07dabd13546b0d3bcb4a764a8e257","ea1c2771e4284f4bcdacb62a0064a59a028b9218a718d56db9e07c4b117931fe","8d5166f22c4685a730f33a467fcc3892ecaa3242f281968db538f30a0ea920cf","857b77187de1c9d48fe47ebe1e84f9efd44cd0ea066e5426624edfc45781969d","f8cfc73372f5890473bb98b627207ef194e894de3150729999742fc7a527f0f2","62d9ffa024dae66be195b71214461896cb2b964028070b015ad94a2e54b93954","e233b1e5942c146e49c79a0ce848e4bdf6db98d517b5531f7734fc22e6bce1a9","d4e269200568991a9425e141a890f0711c92e6e3b8170ad75935eee239f7698f","08e734be7401c3c5a270dc15cbd29a2f6a5bf6ac43e8b2c0f57260212ff5d46a","d98e295457058dfcf8027fe6d78176a5fd8ce24f786842c958752e9f1f7f5917","678f643e9a511377fcf99d13f68575be57966ccd61d13f6ea6942c25237dee1b","712e563991f75b97032e4c62e810abeb40e6207200ba0522e70566b4e1191682","54e1f7552723f921d9e49a1feca24e342092fc9ad8d2eda4a8cdf5a25f5a62f9","5079d40ee37cdd5694cbaef70afe6f5a474a5b01ba45a549302a793e7287afce","5dc0af96253d84d0e67b121ad6cbb5657e55932a4f26c786a3f6a3821776c267","16b6b8391fb837ca5d45170b9108067fc2eec7a693e9083f12a941b922092e2e","e7409fd1b46d9ede5833bc93d3148c4051627beb83fed717834cfa43e7291cac","900799cda37bc6a05a2bd47b9e4362c76be9cae5c8d6784308d345281a87132c","2f3614975d96d7d1b9d5297f2fc7e8dbbcf3252325f2bcac89a8e522f97c17aa","abfeaa6f2f5c81006689ebb4a52c02fa5d0838a3f0cb8f4b2e42f564cb5f54ec","93e74291b9901c4e3f5d97b60af222a5b1c058d775db68fbcf47d1f7be5f53fe","c7a94b540d814797a781b5b21babe95eedc2df82aa3709d808525c5307674d8f","32f19fe36c0b7de953e73bb77b7a749e26fb030bfce68cdb21f91aa71a4adf29","763576f46e855f5b3c6aa9298de7f0193bea055dedf8fd03598df20252924de9","c5277d76954f68e0e62b58f3e8f880a6103c2b